<?xml version="1.0" encoding="UTF-8"?>
<xs:schema xmlns:xs="http://www.w3.org/2001/XMLSchema">
    <xs:element name="Users">
        <xs:complexType>
            <xs:sequence>
                <xs:element name="User" maxOccurs="unbounded" >
                    <xs:complexType>
                        <xs:sequence>
                            <xs:element name="Type">
                                <xs:simpleType>
                                    <xs:restriction base="xs:string">
                                        <xs:enumeration value="Admin"></xs:enumeration>
                                        <xs:enumeration value="Client"></xs:enumeration>
                                    </xs:restriction>
                                </xs:simpleType>
                            </xs:element>
                            <xs:element name="Userid">
                                <xs:simpleType>
                                    <xs:restriction base="xs:string">
                                        <xs:pattern value="TT[0-9]{5}"></xs:pattern>
                                    </xs:restriction>
                                </xs:simpleType>
                            </xs:element>
                            <xs:element name="Name">
                                <xs:complexType>
                                    <xs:sequence>
                                        <xs:element name="First"></xs:element>
                                        <xs:element name="Last"></xs:element>
                                    </xs:sequence>
                                </xs:complexType>
                            </xs:element>
                            <xs:element name="Password"></xs:element>
                            <xs:element name="Hashpassword"></xs:element>
                            <xs:element name="Country"></xs:element>
                            <xs:element name="Contact">
                                <xs:complexType>
                                    <xs:sequence>
                                        <xs:element name="Email"></xs:element>
                                        <xs:element name="Phone"></xs:element>
                                    </xs:sequence>
                                </xs:complexType>
                            </xs:element>
                        </xs:sequence>
                    </xs:complexType>
                </xs:element>
            </xs:sequence>
        </xs:complexType>
    </xs:element>
</xs:schema>
